{
  "symbol": "MP",
  "timestamp": "20251121_190030",
  "date": "2025-11-21",
  "indicators": {
    "Current_Price": 55.27000045776367,
    "SMA_50": 68.63559967041016,
    "SMA_200": 45.44134991645813,
    "RSI": 47.171597844700166,
    "MACD_Value": -3.3569849853994356,
    "MACD_Signal": -3.5093785327298073,
    "MACD_Bullish": "True",
    "BB_PercentB": 0.2289404156224305,
    "HV_30d": 1.0943391146416015,
    "ATR": 5.452364749818722,
    "Avg_Volume_50": 16853597.82,
    "ROC_10d": -5.682590619568043,
    "Stoch_K": 30.382174426458942,
    "MFI": 41.66590694213803,
    "ADL": -97317734.1022555
  },
  "spreads": [
    {
      "type": "Put Credit Spread",
      "expiration": "2025-12-05",
      "sell_strike": 54.0,
      "buy_strike": 49.0,
      "mid_premium": 1.7,
      "max_profit": 170.0,
      "max_loss": 330.0,
      "delta_sell": null,
      "theta_sell": null,
      "vega_sell": null,
      "rationale": "Given the current market context for MP, a put credit spread with a sell strike at $54.00 and a buy strike at $49.00, expiring on December 5, 2025, presents an intriguing opportunity for investors seeking a bullish to neutral position. With the Relative Strength Index (RSI) at 47.17, MP is neither overbought nor oversold, indicating a balanced momentum that could favor a neutral to bullish stance. The Moving Average Convergence Divergence (MACD) value of -3.36 and signal line at -3.51 suggest a bullish momentum, as the MACD line is above the signal line. Additionally, the Stochastic %K at 30.38 indicates that the stock is in the lower range of its price action, potentially signaling an upcoming upward movement. The Bollinger Band %B at 0.23 suggests that the stock is trading near the lower band, which could imply a mean reversion towards the middle or upper bands. The Money Flow Index (MFI) at 41.67 indicates moderate buying pressure, supporting a neutral to bullish outlook.\n\nThe risk/reward profile of this put credit spread is favorable, with an estimated maximum profit of $170.0 and a maximum risk of $330.0, resulting in a reward-to-risk ratio of approximately 0.52. This trade structure allows investors to capitalize on a potential upward movement or stability in MP's stock price while limiting downside risk. The 30-day historical volatility (HV) of 1.09 suggests moderate price fluctuations, which could work in favor of the credit spread strategy by providing opportunities for the options to expire worthless or be closed at a profit.\n\nIn summary, the technical indicators collectively suggest a bullish to neutral outlook for MP, making this put credit spread an attractive option for investors looking to benefit from potential price appreciation or stability in the stock. However, it is crucial to monitor the trade closely and adjust as necessary based on changing market conditions. As always, this analysis is hypothetical and should not be construed as financial advice.\n\n**DISCLAIMER: This is hypothetical analysis, not financial advice.**"
    },
    {
      "type": "Call Credit Spread",
      "expiration": "2025-12-05",
      "sell_strike": 57.0,
      "buy_strike": 62.0,
      "mid_premium": 1.3499999999999996,
      "max_profit": 135.0,
      "max_loss": 365.0,
      "delta_sell": null,
      "theta_sell": null,
      "vega_sell": null,
      "rationale": "Given the current market context for MP, a call credit spread with a sell strike at $57.00 and a buy strike at $62.00 expiring on 2025-12-05 presents an intriguing opportunity for a bearish or neutral strategy. With the Relative Strength Index (RSI) at 47.17, MP is neither overbought nor oversold, suggesting a lack of strong momentum in either direction. This is further supported by the Money Flow Index (MFI) at 41.67, indicating neither significant buying nor selling pressure. The Moving Average Convergence Divergence (MACD) value of -3.36 and signal of -3.51 suggest a slight bullish momentum, but the Rate of Change (10d) at -5.68% indicates a recent downward trend. The Stochastic %K at 30.38 and Bollinger Band %B at 0.23 both suggest that the stock is trading near the lower end of its recent range, potentially indicating a bearish bias.\n\nThe Simple Moving Averages (SMA) provide additional context, with the SMA50 at 68.64 and SMA200 at 45.44, indicating that the stock is trading below both its short-term and long-term averages, which could be a bearish signal. The 30-day historical volatility (HV) at 1.09 suggests moderate volatility, which is favorable for options strategies as it provides a reasonable range for the stock to move within.\n\nThe risk/reward profile of this call credit spread is particularly appealing, with an estimated maximum profit of $135.0 and a maximum risk of $365.0. This setup allows for a favorable risk/reward ratio, where the potential reward is achieved if MP remains below the $57.00 strike price at expiration, while the risk is capped at the difference between the strikes minus the premium received.\n\nIn summary, the combination of neutral to bearish technical indicators, moderate volatility, and a favorable risk/reward profile makes this call credit spread an attractive strategy for investors looking to capitalize on potential downward movement or stagnation in MP's stock price. However, it is crucial to remember that this analysis is hypothetical and should not be construed as financial advice. Always conduct thorough research and consider personal risk tolerance before executing any trade."
    },
    {
      "type": "Put Credit Spread",
      "expiration": "2025-12-19",
      "sell_strike": 55.0,
      "buy_strike": 50.0,
      "mid_premium": 2.325,
      "max_profit": 232.5,
      "max_loss": 267.5,
      "delta_sell": null,
      "theta_sell": null,
      "vega_sell": null,
      "rationale": "Given the current market context for MP, a Put Credit Spread with a sell strike at $55.00 and a buy strike at $50.00, expiring on 2025-12-19, presents an intriguing opportunity for investors seeking a bullish to neutral position. With the Relative Strength Index (RSI) at 47.17, MP is neither overbought nor oversold, indicating a balanced momentum that could favor a range-bound strategy. The Moving Average Convergence Divergence (MACD) value of -3.36, slightly above its signal line at -3.51, suggests a nascent bullish momentum, which aligns with the trade's bullish bias. Additionally, the Stochastic %K at 30.38 indicates that the stock is in the lower range of its trading band, potentially signaling an upcoming upward correction. The Bollinger Band %B at 0.23 further supports this view, as it suggests that the stock is trading near the lower end of its recent volatility range, which could imply a rebound.\n\nThe 50-day Simple Moving Average (SMA) at 68.64 and the 200-day SMA at 45.44 indicate a long-term uptrend, providing a solid foundation for a bullish strategy. The Money Flow Index (MFI) at 41.67 suggests moderate buying pressure, which could contribute to upward price movement. The Rate of Change (10d) at -5.68% indicates a recent decline, but this could present an opportunity to enter a trade at a relatively lower price point.\n\nThe risk/reward profile of this Put Credit Spread is favorable, with an estimated maximum profit of $232.5 and an estimated maximum risk of $267.5. This setup allows investors to capitalize on potential upward price movement while limiting downside risk. The trade's bullish/neutral bias is well-supported by the technical indicators, making it an attractive option for those looking to profit from a potential rebound or stabilization in MP's stock price.\n\nDisclaimer: This is hypothetical analysis and should not be construed as financial advice. Investors should conduct their own research and consider their risk tolerance before making any investment decisions."
    },
    {
      "type": "Call Credit Spread",
      "expiration": "2025-12-19",
      "sell_strike": 60.0,
      "buy_strike": 65.0,
      "mid_premium": 1.25,
      "max_profit": 125.0,
      "max_loss": 375.0,
      "delta_sell": null,
      "theta_sell": null,
      "vega_sell": null,
      "rationale": "Given the current market context for MP, a call credit spread with a sell strike at $60.00 and a buy strike at $65.00 expiring on 2025-12-19 presents an intriguing opportunity for a bearish or neutral strategy. With the Relative Strength Index (RSI) at 47.17, the stock is neither overbought nor oversold, suggesting a neutral momentum that could lean bearish given the negative rate of change of -5.68% over the past 10 days. The Moving Average Convergence Divergence (MACD) value of -3.36, slightly above its signal line at -3.51, indicates a potential bullish momentum, but this is tempered by the stock's price trading below both its 50-day Simple Moving Average (SMA50) at $68.64 and its 200-day SMA200 at $45.44, hinting at a broader downtrend. The Bollinger Band %B value of 0.23 suggests the stock is trading near the lower end of its recent volatility range, which aligns with the bearish sentiment. The Money Flow Index (MFI) at 41.67 indicates moderate buying pressure, but not enough to suggest a strong upward reversal. The Stochastic %K at 30.38 is in the oversold territory, which could imply a potential bounce, but given the overall technical landscape, this bounce might be short-lived or insufficient to push the price significantly above the $60.00 strike.\n\nThe risk/reward profile of this call credit spread is favorable, with an estimated maximum profit of $125.0 and a maximum risk of $375.0, resulting in a risk/reward ratio of approximately 3:1. This setup allows for a relatively low-cost entry into a bearish or neutral position, capitalizing on the current technical indicators that suggest limited upward potential and a higher likelihood of the stock remaining below the $60.00 strike by expiration. The theta decay will work in the trader's favor as time passes, further enhancing the profitability of this strategy if the stock price remains stable or declines. However, it is crucial to monitor the stock's price movements closely, as any significant upward surge could erode the potential gains and increase the risk.\n\nDisclaimer: This analysis is hypothetical and does not constitute financial advice. Investors should conduct their own research and consider their risk tolerance before making any trading decisions."
    },
    {
      "type": "Call Credit Spread",
      "expiration": "2026-01-02",
      "sell_strike": 57.0,
      "buy_strike": 61.0,
      "mid_premium": 1.75,
      "max_profit": 175.0,
      "max_loss": 225.0,
      "delta_sell": null,
      "theta_sell": null,
      "vega_sell": null,
      "rationale": "Given the current market context, a call credit spread on MP presents an intriguing opportunity for traders seeking to capitalize on potential bearish or neutral market sentiment. With the Relative Strength Index (RSI) at 47.17, the stock is neither overbought nor oversold, indicating a balanced momentum that could lean towards a downward correction, especially considering the negative rate of change (-5.68%) over the past ten days. The Moving Average Convergence Divergence (MACD) value of -3.36, slightly above its signal line at -3.51, suggests a weak bullish momentum that may not be sustainable, aligning with the bearish thesis. Additionally, the 50-day Simple Moving Average (SMA) at 68.64 is significantly higher than the current price of $55.27, indicating a downward trend that could continue or stabilize within the Bollinger Band %B of 0.23, which is relatively low and suggests the stock is trading near the lower end of its recent range.\n\nThe stochastic %K at 30.38 further supports the potential for a downward move or consolidation, as it is in the lower third of its range. The 30-day historical volatility at 1.09 provides a reasonable estimate for the expected price movement, reducing the uncertainty in pricing the options. The Money Flow Index (MFI) at 41.67 indicates a lack of strong buying pressure, reinforcing the bearish outlook.\n\nThe chosen call credit spread structure, with a sell strike at $57.00 and a buy strike at $61.00, offers an attractive risk-reward profile. The estimated maximum profit of $175.0 is achieved if MP remains below $57.00 at expiration, while the maximum risk is capped at $225.0 if MP surges above $61.00. This setup allows traders to benefit from either a decline or a sideways movement in MP's price, while limiting potential losses. The absence of specific delta and theta values for the short leg in the provided data does not detract from the overall analysis, as the trade's profitability hinges more on the directional bias and volatility assumptions.\n\nIn summary, the technical indicators collectively suggest a bearish or neutral outlook for MP, making this call credit spread an appealing strategy for traders looking to profit from a potential decline or stabilization in the stock's price. The risk-reward ratio of approximately 1.3:1 (max risk to max reward) is reasonable for this type of strategy, offering a balanced approach to capitalize on the current market conditions without excessive risk exposure. However, it is crucial to remember that this analysis is hypothetical and should not be construed as financial advice. Traders should conduct their own due diligence and consider their risk tolerance and investment objectives before entering any trade."
    },
    {
      "type": "Put Credit Spread",
      "expiration": "2026-01-16",
      "sell_strike": 55.0,
      "buy_strike": 50.0,
      "mid_premium": 2.6500000000000004,
      "max_profit": 265.0,
      "max_loss": 235.0,
      "delta_sell": null,
      "theta_sell": null,
      "vega_sell": null,
      "rationale": "Given the current market context, a Put Credit Spread on MP presents an intriguing opportunity for investors seeking a bullish to neutral strategy. With the stock trading at $55.27, the technical indicators suggest a nuanced market sentiment. The Simple Moving Averages (SMA) reveal a golden cross, with the 50-day SMA ($68.64) above the 200-day SMA ($45.44), indicating a long-term bullish trend. However, the recent price decline has brought the stock closer to the lower Bollinger Band, as evidenced by the Bollinger Band %B at 0.23, suggesting that MP may be slightly oversold in the short term.\n\nThe Relative Strength Index (RSI) at 47.17 supports this notion, indicating that the stock is neither overbought nor oversold but leaning towards the latter, which could imply a potential bounce. The Moving Average Convergence Divergence (MACD) value of -3.36 and signal line at -3.51 show a bullish crossover, further reinforcing the potential for a rebound. The Stochastic %K at 30.38 also suggests that the stock is in the lower range of its trading band, which could signal an upcoming upward correction.\n\nThe Money Flow Index (MFI) at 41.67 indicates a neutral to slightly bearish momentum, which aligns with the Rate of Change (10d) at -5.68%, reflecting recent downward pressure. However, the 30-day historical volatility (HV) at 1.09 suggests that the stock has been relatively stable, which could be beneficial for a defined-risk strategy like a Put Credit Spread.\n\nThe trade structure involves selling a put option at the $55.00 strike and buying a put option at the $50.00 strike, both expiring on 2026-01-16. This setup allows investors to capitalize on the potential stability and slight bullish bias indicated by the technical indicators. The estimated maximum profit is $265.0, while the maximum risk is $235.0, offering a favorable risk-reward profile of approximately 1.13:1.\n\nIn summary, the combination of a golden cross, oversold conditions, and bullish momentum indicators makes this Put Credit Spread an attractive option for investors looking to benefit from a potential rebound or stabilization in MP's stock price. However, it is crucial to remember that this analysis is hypothetical and should not be construed as financial advice. Always conduct thorough research and consider personal risk tolerance before making any investment decisions.\n\n**DISCLAIMER: This is hypothetical analysis, not financial advice.**"
    },
    {
      "type": "Call Credit Spread",
      "expiration": "2026-01-16",
      "sell_strike": 60.0,
      "buy_strike": 65.0,
      "mid_premium": 1.3000000000000003,
      "max_profit": 130.0,
      "max_loss": 370.0,
      "delta_sell": null,
      "theta_sell": null,
      "vega_sell": null,
      "rationale": "Given the current market context for MP, a call credit spread with a sell strike at $60.00 and a buy strike at $65.00, expiring on January 16, 2026, presents an intriguing opportunity for investors seeking to capitalize on potential bearish or neutral market movements. With the Relative Strength Index (RSI) at 47.17, MP is neither overbought nor oversold, indicating a neutral momentum that could lean bearish if the current trend continues. The Moving Average Convergence Divergence (MACD) value of -3.36 and signal of -3.51 suggest a bullish momentum, but the negative values indicate that the bullish momentum is weakening, which aligns with the bearish thesis. The Stochastic %K at 30.38 suggests that the stock is in the lower range of its trading band, potentially indicating a bearish sentiment. The Bollinger Band %B at 0.23 further supports this, as it shows that the stock is trading near the lower end of its recent volatility range. The Money Flow Index (MFI) at 41.67 indicates a slight bearish sentiment, as it is below the neutral level of 50. Additionally, the Rate of Change (10d) at -5.68% suggests a recent decline in price, reinforcing the bearish outlook.\n\nThe risk/reward profile of this call credit spread is favorable, with an estimated maximum profit of $130.0 and an estimated maximum risk of $370.0. This setup allows investors to benefit from a potential decline in MP's stock price or a neutral movement within the specified range, while limiting downside risk. The Greeks for the short leg are not provided, but typically, a call credit spread would have a negative delta, indicating bearish exposure, and a positive theta, indicating a benefit from time decay. This trade structure is particularly appealing in the current market environment, where technical indicators suggest a potential downward trend or stagnation in MP's stock price.\n\nDISCLAIMER: This is hypothetical analysis, not financial advice."
    },
    {
      "type": "Put Credit Spread",
      "expiration": "2026-02-20",
      "sell_strike": 55.0,
      "buy_strike": 50.0,
      "mid_premium": 2.7,
      "max_profit": 270.0,
      "max_loss": 230.0,
      "delta_sell": null,
      "theta_sell": null,
      "vega_sell": null,
      "rationale": "Given the current market context for MP, a Put Credit Spread with an expiration date of 2026-02-20, selling the $55.00 strike and buying the $50.00 strike, presents an intriguing opportunity for investors seeking a bullish to neutral position. With the Relative Strength Index (RSI) at 47.17, MP is neither overbought nor oversold, indicating a balanced momentum that could favor a neutral to bullish outlook. The Moving Average Convergence Divergence (MACD) value of -3.36 and signal line at -3.51 suggest a bullish momentum, as the MACD line is above the signal line, hinting at potential upward price movement. Additionally, the Stochastic %K at 30.38 indicates that the stock is in the lower range of its trading band, which could signal an upcoming reversal to the upside. The Bollinger Band %B at 0.23 further supports this notion, as it suggests that the stock is trading near the lower band, potentially indicating undervaluation.\n\nThe 50-day Simple Moving Average (SMA) at 68.64 and the 200-day SMA at 45.44 reveal a downward trend, but the recent price action at $55.27 shows a significant deviation from the SMA50, which could imply a mean reversion opportunity. The 30-day Historical Volatility (HV) at 1.09 suggests moderate volatility, which is favorable for options strategies as it provides a reasonable range for price movement. The Money Flow Index (MFI) at 41.67 indicates moderate buying pressure, supporting the bullish thesis.\n\nThe trade structure offers an estimated maximum profit of $270.0 and a maximum risk of $230.0, resulting in a risk-reward ratio of approximately 1:1. This ratio is acceptable for a defined-risk strategy like a Put Credit Spread, where the potential reward is commensurate with the risk taken. The Greeks for the short leg are not provided, but generally, a Put Credit Spread benefits from time decay (positive theta) and would ideally have a low delta to minimize directional risk.\n\nIn summary, the combination of technical indicators suggests a bullish to neutral outlook for MP, making this Put Credit Spread an attractive strategy for investors looking to capitalize on potential upward price movement while managing risk through a defined-risk structure. However, it is crucial to remember that this analysis is hypothetical and should not be construed as financial advice. Investors should conduct their own due diligence and consider their risk tolerance and investment objectives before entering any trade."
    },
    {
      "type": "Call Credit Spread",
      "expiration": "2026-02-20",
      "sell_strike": 60.0,
      "buy_strike": 65.0,
      "mid_premium": 1.4500000000000002,
      "max_profit": 145.0,
      "max_loss": 355.0,
      "delta_sell": null,
      "theta_sell": null,
      "vega_sell": null,
      "rationale": "Given the current market context for MP, a call credit spread with a sell strike at $60.00 and a buy strike at $65.00, expiring on 2026-02-20, presents an intriguing opportunity for a bearish to neutral strategy. With the Relative Strength Index (RSI) at 47.17, the stock is neither overbought nor oversold, suggesting a lack of strong momentum in either direction, which aligns well with a neutral to bearish outlook. The Moving Average Convergence Divergence (MACD) value of -3.36 and signal line of -3.51 indicate a slight bullish momentum, but the close proximity of these values suggests a potential weakening of this momentum. The stochastic %K at 30.38 is in the lower range, often interpreted as a potential buying signal in traditional analysis, but given our bearish thesis, we interpret this as a sign that the stock may not have significant upward momentum.\n\nThe 50-day Simple Moving Average (SMA) at 68.64 is notably above the current price of $55.27, indicating a downward trend, while the 200-day SMA at 45.44 suggests a longer-term support level. The Bollinger Band %B at 0.23 indicates that the stock is trading near the lower end of its recent volatility range, which could imply a potential for downward movement or consolidation. The Money Flow Index (MFI) at 41.67 suggests a neutral money flow, neither strongly bullish nor bearish. The Rate of Change (10d) at -5.68% further supports the bearish sentiment, indicating a recent decline in price.\n\nThe risk/reward profile of this call credit spread is favorable, with an estimated maximum profit of $145.0 and an estimated maximum risk of $355.0. This setup allows for a controlled risk approach, capitalizing on the current lack of strong upward momentum and the potential for further downward movement or sideways trading. The theta decay will work in our favor as we approach expiration, enhancing the probability of profit if the stock remains below the $60.00 strike price. However, it's crucial to monitor the Greeks closely, particularly delta and theta, to adjust the position as needed.\n\nIn summary, this call credit spread on MP is an attractive strategy given the current technical indicators, which collectively suggest a bearish to neutral outlook. The risk/reward profile is favorable, and the strategy benefits from theta decay over time. As always, thorough risk management and continuous monitoring are essential to navigate any potential market shifts.\n\nDISCLAIMER: This is hypothetical analysis, not financial advice."
    },
    {
      "type": "Put Credit Spread",
      "expiration": "2026-05-15",
      "sell_strike": 55.0,
      "buy_strike": 50.0,
      "mid_premium": 3.3500000000000005,
      "max_profit": 335.0,
      "max_loss": 165.0,
      "delta_sell": null,
      "theta_sell": null,
      "vega_sell": null,
      "rationale": "Given the current market context for MP, a put credit spread with an expiration date of 2026-05-15, selling the $55.00 strike and buying the $50.00 strike, presents an intriguing opportunity for investors seeking a bullish to neutral strategy. With the Relative Strength Index (RSI) at 47.17, MP is neither overbought nor oversold, indicating a balanced momentum that could potentially favor a neutral to bullish outlook. The Moving Average Convergence Divergence (MACD) value of -3.36 and signal line at -3.51 suggest a bullish momentum, as the MACD line is above the signal line. Additionally, the Stochastic %K at 30.38 indicates that the stock is in the lower range of its trading band, which could imply an upcoming reversal or stabilization.\n\nThe 50-day Simple Moving Average (SMA) at 68.64 and the 200-day SMA at 45.44 suggest that MP is currently trading below its short-term average but above its long-term average, which could indicate a period of consolidation or a potential upward trend. The Bollinger Band %B at 0.23 further supports this view, as it indicates that the stock is trading near the lower end of its recent volatility range. The Money Flow Index (MFI) at 41.67 suggests moderate buying pressure, while the Rate of Change (10d) at -5.68% indicates a recent decline in price, which could present an opportunity for a reversal.\n\nThe risk/reward profile of this put credit spread is particularly appealing, with an estimated maximum profit of $335.0 and a maximum risk of $165.0. This setup allows investors to capitalize on a potential stabilization or upward movement in MP's stock price while limiting downside risk. The 30-day historical volatility (HV) at 1.09 suggests that the stock has been relatively stable, which could further enhance the likelihood of a favorable outcome for this strategy.\n\nIn summary, the combination of technical indicators and the attractive risk/reward profile makes this put credit spread on MP a compelling option for investors looking to implement a bullish to neutral strategy. However, it is crucial to conduct thorough due diligence and consider individual risk tolerance before executing any trade. This analysis is hypothetical and should not be construed as financial advice."
    },
    {
      "type": "Call Credit Spread",
      "expiration": "2026-05-15",
      "sell_strike": 60.0,
      "buy_strike": 65.0,
      "mid_premium": 1.450000000000001,
      "max_profit": 145.0,
      "max_loss": 355.0,
      "delta_sell": null,
      "theta_sell": null,
      "vega_sell": null,
      "rationale": "Given the current market context for MP, a call credit spread with a sell strike at $60.00 and a buy strike at $65.00 expiring on 2026-05-15 presents an intriguing opportunity for traders seeking to capitalize on potential bearish or neutral market conditions. With the Relative Strength Index (RSI) at 47.17, MP is neither overbought nor oversold, indicating a neutral momentum that aligns well with a credit spread strategy. The Moving Average Convergence Divergence (MACD) value of -3.36 and signal line at -3.51 suggest a bullish momentum, but the negative values indicate that the stock may be losing upward momentum, which could be a precursor to a downward trend. The Stochastic %K at 30.38 further supports this view, as it is in the lower range, often interpreted as a sign of potential downward pressure. The Bollinger Band %B at 0.23 indicates that the stock is trading near the lower end of its recent price range, which could imply that it is undervalued and may continue to decline or stabilize at lower levels. The Money Flow Index (MFI) at 41.67 suggests moderate buying pressure, but the Rate of Change (10d) at -5.68% indicates a recent decline in price, reinforcing the bearish outlook. The 30-day historical volatility (HV) at 1.09 provides a reasonable expectation of price movement, allowing for a well-calibrated risk management strategy.\n\nThe trade structure offers an estimated maximum profit of $145.0, with a maximum risk of $355.0, resulting in a risk-reward ratio of approximately 2.45:1. This ratio indicates that the potential reward is relatively modest compared to the risk, which is typical for credit spreads and reflects the strategy's conservative nature. The Greeks for the short leg are not provided, but typically, a call credit spread would have a negative delta, indicating a bearish bias, and a positive theta, benefiting from time decay. Given the current technical indicators and the structure of the trade, this call credit spread on MP could be an attractive option for traders looking to profit from a potential decline or stabilization in the stock price while managing risk through defined loss limits. However, it is crucial to note that this analysis is hypothetical and should not be construed as financial advice. Market conditions can change rapidly, and thorough due diligence is essential before executing any trade."
    }
  ],
  "markdown_report": "# AI-Enhanced Credit Spread Analysis: MP\n\n**Date:** 2025-11-21\n**Reference Price:** $55.27\n\n## Technical Landscape (12 Indicators)\n- **Current_Price:** 55.27\n- **SMA_50:** 68.64\n- **SMA_200:** 45.44\n- **RSI:** 47.17\n- **MACD_Value:** -3.36\n- **MACD_Signal:** -3.51\n- **MACD_Bullish:** True\n- **BB_PercentB:** 0.23\n- **HV_30d:** 1.09\n- **ATR:** 5.45\n- **Avg_Volume_50:** 16853597.82\n- **ROC_10d:** -5.68\n- **Stoch_K:** 30.38\n- **MFI:** 41.67\n- **ADL:** -97317734.10\n\n---\n\n### Put Credit Spread (2025-12-05)\n**Strategy:** Sell $54.0 / Buy $49.0\n**Est. Credit:** $170.0 | **Max Risk:** $330.0\n**Analysis:**\nGiven the current market context for MP, a put credit spread with a sell strike at $54.00 and a buy strike at $49.00, expiring on December 5, 2025, presents an intriguing opportunity for investors seeking a bullish to neutral position. With the Relative Strength Index (RSI) at 47.17, MP is neither overbought nor oversold, indicating a balanced momentum that could favor a neutral to bullish stance. The Moving Average Convergence Divergence (MACD) value of -3.36 and signal line at -3.51 suggest a bullish momentum, as the MACD line is above the signal line. Additionally, the Stochastic %K at 30.38 indicates that the stock is in the lower range of its price action, potentially signaling an upcoming upward movement. The Bollinger Band %B at 0.23 suggests that the stock is trading near the lower band, which could imply a mean reversion towards the middle or upper bands. The Money Flow Index (MFI) at 41.67 indicates moderate buying pressure, supporting a neutral to bullish outlook.\n\nThe risk/reward profile of this put credit spread is favorable, with an estimated maximum profit of $170.0 and a maximum risk of $330.0, resulting in a reward-to-risk ratio of approximately 0.52. This trade structure allows investors to capitalize on a potential upward movement or stability in MP's stock price while limiting downside risk. The 30-day historical volatility (HV) of 1.09 suggests moderate price fluctuations, which could work in favor of the credit spread strategy by providing opportunities for the options to expire worthless or be closed at a profit.\n\nIn summary, the technical indicators collectively suggest a bullish to neutral outlook for MP, making this put credit spread an attractive option for investors looking to benefit from potential price appreciation or stability in the stock. However, it is crucial to monitor the trade closely and adjust as necessary based on changing market conditions. As always, this analysis is hypothetical and should not be construed as financial advice.\n\n**DISCLAIMER: This is hypothetical analysis, not financial advice.**\n\n---\n### Call Credit Spread (2025-12-05)\n**Strategy:** Sell $57.0 / Buy $62.0\n**Est. Credit:** $135.0 | **Max Risk:** $365.0\n**Analysis:**\nGiven the current market context for MP, a call credit spread with a sell strike at $57.00 and a buy strike at $62.00 expiring on 2025-12-05 presents an intriguing opportunity for a bearish or neutral strategy. With the Relative Strength Index (RSI) at 47.17, MP is neither overbought nor oversold, suggesting a lack of strong momentum in either direction. This is further supported by the Money Flow Index (MFI) at 41.67, indicating neither significant buying nor selling pressure. The Moving Average Convergence Divergence (MACD) value of -3.36 and signal of -3.51 suggest a slight bullish momentum, but the Rate of Change (10d) at -5.68% indicates a recent downward trend. The Stochastic %K at 30.38 and Bollinger Band %B at 0.23 both suggest that the stock is trading near the lower end of its recent range, potentially indicating a bearish bias.\n\nThe Simple Moving Averages (SMA) provide additional context, with the SMA50 at 68.64 and SMA200 at 45.44, indicating that the stock is trading below both its short-term and long-term averages, which could be a bearish signal. The 30-day historical volatility (HV) at 1.09 suggests moderate volatility, which is favorable for options strategies as it provides a reasonable range for the stock to move within.\n\nThe risk/reward profile of this call credit spread is particularly appealing, with an estimated maximum profit of $135.0 and a maximum risk of $365.0. This setup allows for a favorable risk/reward ratio, where the potential reward is achieved if MP remains below the $57.00 strike price at expiration, while the risk is capped at the difference between the strikes minus the premium received.\n\nIn summary, the combination of neutral to bearish technical indicators, moderate volatility, and a favorable risk/reward profile makes this call credit spread an attractive strategy for investors looking to capitalize on potential downward movement or stagnation in MP's stock price. However, it is crucial to remember that this analysis is hypothetical and should not be construed as financial advice. Always conduct thorough research and consider personal risk tolerance before executing any trade.\n\n---\n### Put Credit Spread (2025-12-19)\n**Strategy:** Sell $55.0 / Buy $50.0\n**Est. Credit:** $232.5 | **Max Risk:** $267.5\n**Analysis:**\nGiven the current market context for MP, a Put Credit Spread with a sell strike at $55.00 and a buy strike at $50.00, expiring on 2025-12-19, presents an intriguing opportunity for investors seeking a bullish to neutral position. With the Relative Strength Index (RSI) at 47.17, MP is neither overbought nor oversold, indicating a balanced momentum that could favor a range-bound strategy. The Moving Average Convergence Divergence (MACD) value of -3.36, slightly above its signal line at -3.51, suggests a nascent bullish momentum, which aligns with the trade's bullish bias. Additionally, the Stochastic %K at 30.38 indicates that the stock is in the lower range of its trading band, potentially signaling an upcoming upward correction. The Bollinger Band %B at 0.23 further supports this view, as it suggests that the stock is trading near the lower end of its recent volatility range, which could imply a rebound.\n\nThe 50-day Simple Moving Average (SMA) at 68.64 and the 200-day SMA at 45.44 indicate a long-term uptrend, providing a solid foundation for a bullish strategy. The Money Flow Index (MFI) at 41.67 suggests moderate buying pressure, which could contribute to upward price movement. The Rate of Change (10d) at -5.68% indicates a recent decline, but this could present an opportunity to enter a trade at a relatively lower price point.\n\nThe risk/reward profile of this Put Credit Spread is favorable, with an estimated maximum profit of $232.5 and an estimated maximum risk of $267.5. This setup allows investors to capitalize on potential upward price movement while limiting downside risk. The trade's bullish/neutral bias is well-supported by the technical indicators, making it an attractive option for those looking to profit from a potential rebound or stabilization in MP's stock price.\n\nDisclaimer: This is hypothetical analysis and should not be construed as financial advice. Investors should conduct their own research and consider their risk tolerance before making any investment decisions.\n\n---\n### Call Credit Spread (2025-12-19)\n**Strategy:** Sell $60.0 / Buy $65.0\n**Est. Credit:** $125.0 | **Max Risk:** $375.0\n**Analysis:**\nGiven the current market context for MP, a call credit spread with a sell strike at $60.00 and a buy strike at $65.00 expiring on 2025-12-19 presents an intriguing opportunity for a bearish or neutral strategy. With the Relative Strength Index (RSI) at 47.17, the stock is neither overbought nor oversold, suggesting a neutral momentum that could lean bearish given the negative rate of change of -5.68% over the past 10 days. The Moving Average Convergence Divergence (MACD) value of -3.36, slightly above its signal line at -3.51, indicates a potential bullish momentum, but this is tempered by the stock's price trading below both its 50-day Simple Moving Average (SMA50) at $68.64 and its 200-day SMA200 at $45.44, hinting at a broader downtrend. The Bollinger Band %B value of 0.23 suggests the stock is trading near the lower end of its recent volatility range, which aligns with the bearish sentiment. The Money Flow Index (MFI) at 41.67 indicates moderate buying pressure, but not enough to suggest a strong upward reversal. The Stochastic %K at 30.38 is in the oversold territory, which could imply a potential bounce, but given the overall technical landscape, this bounce might be short-lived or insufficient to push the price significantly above the $60.00 strike.\n\nThe risk/reward profile of this call credit spread is favorable, with an estimated maximum profit of $125.0 and a maximum risk of $375.0, resulting in a risk/reward ratio of approximately 3:1. This setup allows for a relatively low-cost entry into a bearish or neutral position, capitalizing on the current technical indicators that suggest limited upward potential and a higher likelihood of the stock remaining below the $60.00 strike by expiration. The theta decay will work in the trader's favor as time passes, further enhancing the profitability of this strategy if the stock price remains stable or declines. However, it is crucial to monitor the stock's price movements closely, as any significant upward surge could erode the potential gains and increase the risk.\n\nDisclaimer: This analysis is hypothetical and does not constitute financial advice. Investors should conduct their own research and consider their risk tolerance before making any trading decisions.\n\n---\n### Call Credit Spread (2026-01-02)\n**Strategy:** Sell $57.0 / Buy $61.0\n**Est. Credit:** $175.0 | **Max Risk:** $225.0\n**Analysis:**\nGiven the current market context, a call credit spread on MP presents an intriguing opportunity for traders seeking to capitalize on potential bearish or neutral market sentiment. With the Relative Strength Index (RSI) at 47.17, the stock is neither overbought nor oversold, indicating a balanced momentum that could lean towards a downward correction, especially considering the negative rate of change (-5.68%) over the past ten days. The Moving Average Convergence Divergence (MACD) value of -3.36, slightly above its signal line at -3.51, suggests a weak bullish momentum that may not be sustainable, aligning with the bearish thesis. Additionally, the 50-day Simple Moving Average (SMA) at 68.64 is significantly higher than the current price of $55.27, indicating a downward trend that could continue or stabilize within the Bollinger Band %B of 0.23, which is relatively low and suggests the stock is trading near the lower end of its recent range.\n\nThe stochastic %K at 30.38 further supports the potential for a downward move or consolidation, as it is in the lower third of its range. The 30-day historical volatility at 1.09 provides a reasonable estimate for the expected price movement, reducing the uncertainty in pricing the options. The Money Flow Index (MFI) at 41.67 indicates a lack of strong buying pressure, reinforcing the bearish outlook.\n\nThe chosen call credit spread structure, with a sell strike at $57.00 and a buy strike at $61.00, offers an attractive risk-reward profile. The estimated maximum profit of $175.0 is achieved if MP remains below $57.00 at expiration, while the maximum risk is capped at $225.0 if MP surges above $61.00. This setup allows traders to benefit from either a decline or a sideways movement in MP's price, while limiting potential losses. The absence of specific delta and theta values for the short leg in the provided data does not detract from the overall analysis, as the trade's profitability hinges more on the directional bias and volatility assumptions.\n\nIn summary, the technical indicators collectively suggest a bearish or neutral outlook for MP, making this call credit spread an appealing strategy for traders looking to profit from a potential decline or stabilization in the stock's price. The risk-reward ratio of approximately 1.3:1 (max risk to max reward) is reasonable for this type of strategy, offering a balanced approach to capitalize on the current market conditions without excessive risk exposure. However, it is crucial to remember that this analysis is hypothetical and should not be construed as financial advice. Traders should conduct their own due diligence and consider their risk tolerance and investment objectives before entering any trade.\n\n---\n### Put Credit Spread (2026-01-16)\n**Strategy:** Sell $55.0 / Buy $50.0\n**Est. Credit:** $265.0 | **Max Risk:** $235.0\n**Analysis:**\nGiven the current market context, a Put Credit Spread on MP presents an intriguing opportunity for investors seeking a bullish to neutral strategy. With the stock trading at $55.27, the technical indicators suggest a nuanced market sentiment. The Simple Moving Averages (SMA) reveal a golden cross, with the 50-day SMA ($68.64) above the 200-day SMA ($45.44), indicating a long-term bullish trend. However, the recent price decline has brought the stock closer to the lower Bollinger Band, as evidenced by the Bollinger Band %B at 0.23, suggesting that MP may be slightly oversold in the short term.\n\nThe Relative Strength Index (RSI) at 47.17 supports this notion, indicating that the stock is neither overbought nor oversold but leaning towards the latter, which could imply a potential bounce. The Moving Average Convergence Divergence (MACD) value of -3.36 and signal line at -3.51 show a bullish crossover, further reinforcing the potential for a rebound. The Stochastic %K at 30.38 also suggests that the stock is in the lower range of its trading band, which could signal an upcoming upward correction.\n\nThe Money Flow Index (MFI) at 41.67 indicates a neutral to slightly bearish momentum, which aligns with the Rate of Change (10d) at -5.68%, reflecting recent downward pressure. However, the 30-day historical volatility (HV) at 1.09 suggests that the stock has been relatively stable, which could be beneficial for a defined-risk strategy like a Put Credit Spread.\n\nThe trade structure involves selling a put option at the $55.00 strike and buying a put option at the $50.00 strike, both expiring on 2026-01-16. This setup allows investors to capitalize on the potential stability and slight bullish bias indicated by the technical indicators. The estimated maximum profit is $265.0, while the maximum risk is $235.0, offering a favorable risk-reward profile of approximately 1.13:1.\n\nIn summary, the combination of a golden cross, oversold conditions, and bullish momentum indicators makes this Put Credit Spread an attractive option for investors looking to benefit from a potential rebound or stabilization in MP's stock price. However, it is crucial to remember that this analysis is hypothetical and should not be construed as financial advice. Always conduct thorough research and consider personal risk tolerance before making any investment decisions.\n\n**DISCLAIMER: This is hypothetical analysis, not financial advice.**\n\n---\n### Call Credit Spread (2026-01-16)\n**Strategy:** Sell $60.0 / Buy $65.0\n**Est. Credit:** $130.0 | **Max Risk:** $370.0\n**Analysis:**\nGiven the current market context for MP, a call credit spread with a sell strike at $60.00 and a buy strike at $65.00, expiring on January 16, 2026, presents an intriguing opportunity for investors seeking to capitalize on potential bearish or neutral market movements. With the Relative Strength Index (RSI) at 47.17, MP is neither overbought nor oversold, indicating a neutral momentum that could lean bearish if the current trend continues. The Moving Average Convergence Divergence (MACD) value of -3.36 and signal of -3.51 suggest a bullish momentum, but the negative values indicate that the bullish momentum is weakening, which aligns with the bearish thesis. The Stochastic %K at 30.38 suggests that the stock is in the lower range of its trading band, potentially indicating a bearish sentiment. The Bollinger Band %B at 0.23 further supports this, as it shows that the stock is trading near the lower end of its recent volatility range. The Money Flow Index (MFI) at 41.67 indicates a slight bearish sentiment, as it is below the neutral level of 50. Additionally, the Rate of Change (10d) at -5.68% suggests a recent decline in price, reinforcing the bearish outlook.\n\nThe risk/reward profile of this call credit spread is favorable, with an estimated maximum profit of $130.0 and an estimated maximum risk of $370.0. This setup allows investors to benefit from a potential decline in MP's stock price or a neutral movement within the specified range, while limiting downside risk. The Greeks for the short leg are not provided, but typically, a call credit spread would have a negative delta, indicating bearish exposure, and a positive theta, indicating a benefit from time decay. This trade structure is particularly appealing in the current market environment, where technical indicators suggest a potential downward trend or stagnation in MP's stock price.\n\nDISCLAIMER: This is hypothetical analysis, not financial advice.\n\n---\n### Put Credit Spread (2026-02-20)\n**Strategy:** Sell $55.0 / Buy $50.0\n**Est. Credit:** $270.0 | **Max Risk:** $230.0\n**Analysis:**\nGiven the current market context for MP, a Put Credit Spread with an expiration date of 2026-02-20, selling the $55.00 strike and buying the $50.00 strike, presents an intriguing opportunity for investors seeking a bullish to neutral position. With the Relative Strength Index (RSI) at 47.17, MP is neither overbought nor oversold, indicating a balanced momentum that could favor a neutral to bullish outlook. The Moving Average Convergence Divergence (MACD) value of -3.36 and signal line at -3.51 suggest a bullish momentum, as the MACD line is above the signal line, hinting at potential upward price movement. Additionally, the Stochastic %K at 30.38 indicates that the stock is in the lower range of its trading band, which could signal an upcoming reversal to the upside. The Bollinger Band %B at 0.23 further supports this notion, as it suggests that the stock is trading near the lower band, potentially indicating undervaluation.\n\nThe 50-day Simple Moving Average (SMA) at 68.64 and the 200-day SMA at 45.44 reveal a downward trend, but the recent price action at $55.27 shows a significant deviation from the SMA50, which could imply a mean reversion opportunity. The 30-day Historical Volatility (HV) at 1.09 suggests moderate volatility, which is favorable for options strategies as it provides a reasonable range for price movement. The Money Flow Index (MFI) at 41.67 indicates moderate buying pressure, supporting the bullish thesis.\n\nThe trade structure offers an estimated maximum profit of $270.0 and a maximum risk of $230.0, resulting in a risk-reward ratio of approximately 1:1. This ratio is acceptable for a defined-risk strategy like a Put Credit Spread, where the potential reward is commensurate with the risk taken. The Greeks for the short leg are not provided, but generally, a Put Credit Spread benefits from time decay (positive theta) and would ideally have a low delta to minimize directional risk.\n\nIn summary, the combination of technical indicators suggests a bullish to neutral outlook for MP, making this Put Credit Spread an attractive strategy for investors looking to capitalize on potential upward price movement while managing risk through a defined-risk structure. However, it is crucial to remember that this analysis is hypothetical and should not be construed as financial advice. Investors should conduct their own due diligence and consider their risk tolerance and investment objectives before entering any trade.\n\n---\n### Call Credit Spread (2026-02-20)\n**Strategy:** Sell $60.0 / Buy $65.0\n**Est. Credit:** $145.0 | **Max Risk:** $355.0\n**Analysis:**\nGiven the current market context for MP, a call credit spread with a sell strike at $60.00 and a buy strike at $65.00, expiring on 2026-02-20, presents an intriguing opportunity for a bearish to neutral strategy. With the Relative Strength Index (RSI) at 47.17, the stock is neither overbought nor oversold, suggesting a lack of strong momentum in either direction, which aligns well with a neutral to bearish outlook. The Moving Average Convergence Divergence (MACD) value of -3.36 and signal line of -3.51 indicate a slight bullish momentum, but the close proximity of these values suggests a potential weakening of this momentum. The stochastic %K at 30.38 is in the lower range, often interpreted as a potential buying signal in traditional analysis, but given our bearish thesis, we interpret this as a sign that the stock may not have significant upward momentum.\n\nThe 50-day Simple Moving Average (SMA) at 68.64 is notably above the current price of $55.27, indicating a downward trend, while the 200-day SMA at 45.44 suggests a longer-term support level. The Bollinger Band %B at 0.23 indicates that the stock is trading near the lower end of its recent volatility range, which could imply a potential for downward movement or consolidation. The Money Flow Index (MFI) at 41.67 suggests a neutral money flow, neither strongly bullish nor bearish. The Rate of Change (10d) at -5.68% further supports the bearish sentiment, indicating a recent decline in price.\n\nThe risk/reward profile of this call credit spread is favorable, with an estimated maximum profit of $145.0 and an estimated maximum risk of $355.0. This setup allows for a controlled risk approach, capitalizing on the current lack of strong upward momentum and the potential for further downward movement or sideways trading. The theta decay will work in our favor as we approach expiration, enhancing the probability of profit if the stock remains below the $60.00 strike price. However, it's crucial to monitor the Greeks closely, particularly delta and theta, to adjust the position as needed.\n\nIn summary, this call credit spread on MP is an attractive strategy given the current technical indicators, which collectively suggest a bearish to neutral outlook. The risk/reward profile is favorable, and the strategy benefits from theta decay over time. As always, thorough risk management and continuous monitoring are essential to navigate any potential market shifts.\n\nDISCLAIMER: This is hypothetical analysis, not financial advice.\n\n---\n### Put Credit Spread (2026-05-15)\n**Strategy:** Sell $55.0 / Buy $50.0\n**Est. Credit:** $335.0 | **Max Risk:** $165.0\n**Analysis:**\nGiven the current market context for MP, a put credit spread with an expiration date of 2026-05-15, selling the $55.00 strike and buying the $50.00 strike, presents an intriguing opportunity for investors seeking a bullish to neutral strategy. With the Relative Strength Index (RSI) at 47.17, MP is neither overbought nor oversold, indicating a balanced momentum that could potentially favor a neutral to bullish outlook. The Moving Average Convergence Divergence (MACD) value of -3.36 and signal line at -3.51 suggest a bullish momentum, as the MACD line is above the signal line. Additionally, the Stochastic %K at 30.38 indicates that the stock is in the lower range of its trading band, which could imply an upcoming reversal or stabilization.\n\nThe 50-day Simple Moving Average (SMA) at 68.64 and the 200-day SMA at 45.44 suggest that MP is currently trading below its short-term average but above its long-term average, which could indicate a period of consolidation or a potential upward trend. The Bollinger Band %B at 0.23 further supports this view, as it indicates that the stock is trading near the lower end of its recent volatility range. The Money Flow Index (MFI) at 41.67 suggests moderate buying pressure, while the Rate of Change (10d) at -5.68% indicates a recent decline in price, which could present an opportunity for a reversal.\n\nThe risk/reward profile of this put credit spread is particularly appealing, with an estimated maximum profit of $335.0 and a maximum risk of $165.0. This setup allows investors to capitalize on a potential stabilization or upward movement in MP's stock price while limiting downside risk. The 30-day historical volatility (HV) at 1.09 suggests that the stock has been relatively stable, which could further enhance the likelihood of a favorable outcome for this strategy.\n\nIn summary, the combination of technical indicators and the attractive risk/reward profile makes this put credit spread on MP a compelling option for investors looking to implement a bullish to neutral strategy. However, it is crucial to conduct thorough due diligence and consider individual risk tolerance before executing any trade. This analysis is hypothetical and should not be construed as financial advice.\n\n---\n### Call Credit Spread (2026-05-15)\n**Strategy:** Sell $60.0 / Buy $65.0\n**Est. Credit:** $145.0 | **Max Risk:** $355.0\n**Analysis:**\nGiven the current market context for MP, a call credit spread with a sell strike at $60.00 and a buy strike at $65.00 expiring on 2026-05-15 presents an intriguing opportunity for traders seeking to capitalize on potential bearish or neutral market conditions. With the Relative Strength Index (RSI) at 47.17, MP is neither overbought nor oversold, indicating a neutral momentum that aligns well with a credit spread strategy. The Moving Average Convergence Divergence (MACD) value of -3.36 and signal line at -3.51 suggest a bullish momentum, but the negative values indicate that the stock may be losing upward momentum, which could be a precursor to a downward trend. The Stochastic %K at 30.38 further supports this view, as it is in the lower range, often interpreted as a sign of potential downward pressure. The Bollinger Band %B at 0.23 indicates that the stock is trading near the lower end of its recent price range, which could imply that it is undervalued and may continue to decline or stabilize at lower levels. The Money Flow Index (MFI) at 41.67 suggests moderate buying pressure, but the Rate of Change (10d) at -5.68% indicates a recent decline in price, reinforcing the bearish outlook. The 30-day historical volatility (HV) at 1.09 provides a reasonable expectation of price movement, allowing for a well-calibrated risk management strategy.\n\nThe trade structure offers an estimated maximum profit of $145.0, with a maximum risk of $355.0, resulting in a risk-reward ratio of approximately 2.45:1. This ratio indicates that the potential reward is relatively modest compared to the risk, which is typical for credit spreads and reflects the strategy's conservative nature. The Greeks for the short leg are not provided, but typically, a call credit spread would have a negative delta, indicating a bearish bias, and a positive theta, benefiting from time decay. Given the current technical indicators and the structure of the trade, this call credit spread on MP could be an attractive option for traders looking to profit from a potential decline or stabilization in the stock price while managing risk through defined loss limits. However, it is crucial to note that this analysis is hypothetical and should not be construed as financial advice. Market conditions can change rapidly, and thorough due diligence is essential before executing any trade.\n\n---\n"
}